root@lamp-ubuntu-s-1vcpu-1gb-tor1-01:~# tcpdump -c 5 -i eth0
tcpdump: verbose output suppressed, use -v or -vv for full protocol decode
listening on eth0, link-type EN10MB (Ethernet), capture size 262144 bytes
00:42:21.195313 IP 165.227.42.214.ssh > cpef85e424c507d-cmf85e424c507b.cpe.net.cable.rogers.com.50317: Flags [P.], seq 1946931550:1946931586, ack 374214104, win 501, length 36
00:42:21.196600 IP 165.227.42.214.ssh > cpef85e424c507d-cmf85e424c507b.cpe.net.cable.rogers.com.50317: Flags [P.], seq 36:144, ack 1, win 501, length 108
00:42:21.196671 IP 165.227.42.214.ssh > cpef85e424c507d-cmf85e424c507b.cpe.net.cable.rogers.com.50317: Flags [P.], seq 144:288, ack 1, win 501, length 144
00:42:21.196710 IP 165.227.42.214.ssh > cpef85e424c507d-cmf85e424c507b.cpe.net.cable.rogers.com.50317: Flags [P.], seq 288:324, ack 1, win 501, length 36
00:42:21.197112 IP 165.227.42.214.36090 > dns.google.domain: 64830+ PTR? 91.135.244.99.in-addr.arpa. (44)
5 packets captured
