00:49:00.929873 IP 165.227.42.214.ssh > cpef85e424c507d-cmf85e424c507b.cpe.net.cable.rogers.com.50317: Flags [P.], seq 3249576:3249780, ack 1837, win 2258, length 204
00:49:00.929985 IP 165.227.42.214.ssh > cpef85e424c507d-cmf85e424c507b.cpe.net.cable.rogers.com.50317: Flags [P.], seq 3249780:3249984, ack 1837, win 2258, length 204
00:49:00.930089 IP 165.227.42.214.ssh > cpef85e424c507d-cmf85e424c507b.cpe.net.cable.rogers.com.50317: Flags [P.], seq 3249984:3250188, ack 1837, win 2258, length 204
00:49:00.930212 IP 165.227.42.214.ssh > cpef85e424c507d-cmf85e424c507b.cpe.net.cable.rogers.com.50317: Flags [P.], seq 3250188:3250392, ack 1837, win 2258, length 204
00:49:00.930310 IP 165.227.42.214.ssh > cpef85e424c507d-cmf85e424c507b.cpe.net.cable.rogers.com.50317: Flags [P.], seq 3250392:3250596, ack 1837, win 2258, length 204
00:49:00.930410 IP 165.227.42.214.ssh > cpef85e424c507d-cmf85e424c507b.cpe.net.cable.rogers.com.50317: Flags [P.], seq 3250596:3250800, ack 1837, win 2258, length 204
00:49:00.930512 IP 165.227.42.214.ssh > cpef85e424c507d-cmf85e424c507b.cpe.net.cable.rogers.com.50317: Flags [P.], seq 3250800:3251004, ack 1837, win 2258, length 204
00:49:00.930618 IP 165.227.42.214.ssh > cpef85e424c507d-cmf85e424c507b.cpe.net.cable.rogers.com.50317: Flags [P.], seq 3251004:3251208, ack 1837, win 2258, length 204
00:49:00.930721 IP 165.227.42.214.ssh > cpef85e424c507d-cmf85e424c507b.cpe.net.cable.rogers.com.50317: Flags [P.], seq 3251208:3251412, ack 1837, win 2258, length 204
00:49:00.930823 IP 165.227.42.214.ssh > cpef85e424c507d-cmf85e424c507b.cpe.net.cable.rogers.com.50317: Flags [P.], seq 3251412:3251616, ack 1837, win 2258, length 204
00:49:00.930920 IP 165.227.42.214.ssh > cpef85e424c507d-cmf85e424c507b.cpe.net.cable.rogers.com.50317: Flags [P.], seq 3251616:3251820, ack 1837, win 2258, length 204
00:49:00.931019 IP 165.227.42.214.ssh > cpef85e424c507d-cmf85e424c507b.cpe.net.cable.rogers.com.50317: Flags [P.], seq 3251820:3252024, ack 1837, win 2258, length 204
00:49:00.931128 IP 165.227.42.214.ssh > cpef85e424c507d-cmf85e424c507b.cpe.net.cable.rogers.com.50317: Flags [P.], seq 3252024:3252228, ack 1837, win 2258, length 204
00:49:00.931224 IP 165.227.42.214.ssh > cpef85e424c507d-cmf85e424c507b.cpe.net.cable.rogers.com.50317: Flags [P.], seq 3252228:3252432, ack 1837, win 2258, length 204
00:49:00.931317 IP 165.227.42.214.ssh > cpef85e424c507d-cmf85e424c507b.cpe.net.cable.rogers.com.50317: Flags [P.], seq 3252432:3252636, ack 1837, win 2258, length 204
00:49:00.931414 IP 165.227.42.214.ssh > cpef85e424c507d-cmf85e424c507b.cpe.net.cable.rogers.com.50317: Flags [P.], seq 3252636:3252840, ack 1837, win 2258, length 204
00:49:00.931514 IP 165.227.42.214.ssh > cpef85e424c507d-cmf85e424c507b.cpe.net.cable.rogers.com.50317: Flags [P.], seq 3252840:3253044, ack 1837, win 2258, length 204
00:49:00.931614 IP 165.227.42.214.ssh > cpef85e424c507d-cmf85e424c507b.cpe.net.cable.rogers.com.50317: Flags [P.], seq 3253044:3253248, ack 1837, win 2258, length 204
00:49:00.931721 IP 165.227.42.214.ssh > cpef85e424c507d-cmf85e424c507b.cpe.net.cable.rogers.com.50317: Flags [P.], seq 3253248:3253452, ack 1837, win 2258, length 204
00:49:00.931954 IP 165.227.42.214.ssh > cpef85e424c507d-cmf85e424c507b.cpe.net.cable.rogers.com.50317: Flags [P.], seq 3253452:3253656, ack 1837, win 2258, length 204
00:49:00.932086 IP 165.227.42.214.ssh > cpef85e424c507d-cmf85e424c507b.cpe.net.cable.rogers.com.50317: Flags [P.], seq 3253656:3253860, ack 1837, win 2258, length 204
00:49:00.932217 IP 165.227.42.214.ssh > cpef85e424c507d-cmf85e424c507b.cpe.net.cable.rogers.com.50317: Flags [P.], seq 3253860:3254064, ack 1837, win 2258, length 204
00:49:00.932317 IP 165.227.42.214.ssh > cpef85e424c507d-cmf85e424c507b.cpe.net.cable.rogers.com.50317: Flags [P.], seq 3254064:3254268, ack 1837, win 2258, length 204
00:49:00.932423 IP 165.227.42.214.ssh > cpef85e424c507d-cmf85e424c507b.cpe.net.cable.rogers.com.50317: Flags [P.], seq 3254268:3254472, ack 1837, win 2258, length 204
00:49:00.932530 IP 165.227.42.214.ssh > cpef85e424c507d-cmf85e424c507b.cpe.net.cable.rogers.com.50317: Flags [P.], seq 3254472:3254676, ack 1837, win 2258, length 204
00:49:00.932635 IP 165.227.42.214.ssh > cpef85e424c507d-cmf85e424c507b.cpe.net.cable.rogers.com.50317: Flags [P.], seq 3254676:3254880, ack 1837, win 2258, length 204
00:49:00.932734 IP 165.227.42.214.ssh > cpef85e424c507d-cmf85e424c507b.cpe.net.cable.rogers.com.50317: Flags [P.], seq 3254880:3255084, ack 1837, win 2258, length 204
00:49:00.932839 IP 165.227.42.214.ssh > cpef85e424c507d-cmf85e424c507b.cpe.net.cable.rogers.com.50317: Flags [P.], seq 3255084:3255288, ack 1837, win 2258, length 204
